00:00.0 Host bridge [0600]: Intel Corporation Mobile 4 Series Chipset Memory Controller Hub [8086:2a40] (rev 07)
	Subsystem: Dell Device [1028:0252]
	Control: I/O- Mem+ BusMaster+ SpecCycle- MemWINV- VGASnoop- ParErr- Stepping- SERR- FastB2B- DisINTx-
	Status: Cap+ 66MHz- UDF- FastB2B+ ParErr- DEVSEL=fast >TAbort- <TAbort- <MAbort+ >SERR- <PERR- INTx-
	Latency: 0
	Capabilities: <access denied>
	Kernel driver in use: agpgart-intel

00:02.0 VGA compatible controller [0300]: Intel Corporation Mobile 4 Series Chipset Integrated Graphics Controller [8086:2a42] (rev 07) (prog-if 00 [VGA controller])
	Subsystem: Dell Device [1028:0252]
	Control: I/O+ Mem+ BusMaster+ SpecCycle- MemWINV- VGASnoop- ParErr- Stepping- SERR- FastB2B- DisINTx+
	Status: Cap+ 66MHz- UDF- FastB2B+ ParErr- DEVSEL=fast >TAbort- <TAbort- <MAbort- >SERR- <PERR- INTx-
	Latency: 0
	Interrupt: pin A routed to IRQ 28
	Region 0: Memory at f6c00000 (64-bit, non-prefetchable) [size=4M]
	Region 2: Memory at e0000000 (64-bit, prefetchable) [size=256M]
	Region 4: I/O ports at ef98 [size=8]
	Expansion ROM at <unassigned> [disabled]
	Capabilities: <access denied>
	Kernel driver in use: i915
	Kernel modules: i915

00:02.1 Display controller [0380]: Intel Corporation Mobile 4 Series Chipset Integrated Graphics Controller [8086:2a43] (rev 07)
	Subsystem: Dell Device [1028:0252]
	Control: I/O+ Mem+ BusMaster+ SpecCycle- MemWINV- VGASnoop- ParErr- Stepping- SERR- FastB2B- DisINTx-
	Status: Cap+ 66MHz- UDF- FastB2B+ ParErr- DEVSEL=fast >TAbort- <TAbort- <MAbort- >SERR- <PERR- INTx-
	Latency: 0
	Region 0: Memory at f6b00000 (64-bit, non-prefetchable) [size=1M]
	Capabilities: <access denied>

00:19.0 Ethernet controller [0200]: Intel Corporation 82567LM Gigabit Network Connection [8086:10f5] (rev 03)
	Subsystem: Dell Device [1028:0252]
	Control: I/O+ Mem+ BusMaster+ SpecCycle- MemWINV- VGASnoop- ParErr- Stepping- SERR+ FastB2B- DisINTx+
	Status: Cap+ 66MHz- UDF- FastB2B- ParErr- DEVSEL=fast >TAbort- <TAbort- <MAbort- >SERR- <PERR- INTx-
	Latency: 0
	Interrupt: pin A routed to IRQ 29
	Region 0: Memory at f6ae0000 (32-bit, non-prefetchable) [size=128K]
	Region 1: Memory at f6adb000 (32-bit, non-prefetchable) [size=4K]
	Region 2: I/O ports at efe0 [size=32]
	Capabilities: <access denied>
	Kernel driver in use: e1000e
	Kernel modules: e1000e

00:1a.0 USB Controller [0c03]: Intel Corporation 82801I (ICH9 Family) USB UHCI Controller #4 [8086:2937] (rev 03) (prog-if 00 [UHCI])
	Subsystem: Dell Device [1028:0252]
	Control: I/O+ Mem- BusMaster+ SpecCycle- MemWINV- VGASnoop- ParErr- Stepping- SERR- FastB2B- DisINTx-
	Status: Cap+ 66MHz- UDF- FastB2B+ ParErr- DEVSEL=medium >TAbort- <TAbort- <MAbort- >SERR- <PERR- INTx-
	Latency: 0
	Interrupt: pin A routed to IRQ 20
	Region 4: I/O ports at 6f60 [size=32]
	Capabilities: <access denied>
	Kernel driver in use: uhci_hcd
	Kernel modules: uhci-hcd

00:1a.1 USB Controller [0c03]: Intel Corporation 82801I (ICH9 Family) USB UHCI Controller #5 [8086:2938] (rev 03) (prog-if 00 [UHCI])
	Subsystem: Dell Device [1028:0252]
	Control: I/O+ Mem- BusMaster+ SpecCycle- MemWINV- VGASnoop- ParErr- Stepping- SERR- FastB2B- DisINTx-
	Status: Cap+ 66MHz- UDF- FastB2B+ ParErr- DEVSEL=medium >TAbort- <TAbort- <MAbort- >SERR- <PERR- INTx-
	Latency: 0
	Interrupt: pin B routed to IRQ 21
	Region 4: I/O ports at 6f80 [size=32]
	Capabilities: <access denied>
	Kernel driver in use: uhci_hcd
	Kernel modules: uhci-hcd

00:1a.2 USB Controller [0c03]: Intel Corporation 82801I (ICH9 Family) USB UHCI Controller #6 [8086:2939] (rev 03) (prog-if 00 [UHCI])
	Subsystem: Dell Device [1028:0252]
	Control: I/O+ Mem- BusMaster+ SpecCycle- MemWINV- VGASnoop- ParErr- Stepping- SERR- FastB2B- DisINTx-
	Status: Cap+ 66MHz- UDF- FastB2B+ ParErr- DEVSEL=medium >TAbort- <TAbort- <MAbort- >SERR- <PERR- INTx-
	Latency: 0
	Interrupt: pin C routed to IRQ 22
	Region 4: I/O ports at 6fa0 [size=32]
	Capabilities: <access denied>
	Kernel driver in use: uhci_hcd
	Kernel modules: uhci-hcd

00:1a.7 USB Controller [0c03]: Intel Corporation 82801I (ICH9 Family) USB2 EHCI Controller #2 [8086:293c] (rev 03) (prog-if 20 [EHCI])
	Subsystem: Dell Device [1028:0252]
	Control: I/O- Mem+ BusMaster+ SpecCycle- MemWINV- VGASnoop- ParErr- Stepping- SERR+ FastB2B- DisINTx-
	Status: Cap+ 66MHz- UDF- FastB2B+ ParErr- DEVSEL=medium >TAbort- <TAbort- <MAbort- >SERR- <PERR- INTx-
	Latency: 0
	Interrupt: pin C routed to IRQ 22
	Region 0: Memory at fed1c400 (32-bit, non-prefetchable) [size=1K]
	Capabilities: <access denied>
	Kernel driver in use: ehci_hcd
	Kernel modules: ehci-hcd

00:1b.0 Audio device [0403]: Intel Corporation 82801I (ICH9 Family) HD Audio Controller [8086:293e] (rev 03)
	Subsystem: Dell Device [1028:0252]
	Control: I/O- Mem+ BusMaster+ SpecCycle- MemWINV- VGASnoop- ParErr- Stepping- SERR+ FastB2B- DisINTx+
	Status: Cap+ 66MHz- UDF- FastB2B- ParErr- DEVSEL=fast >TAbort- <TAbort- <MAbort- >SERR- <PERR- INTx-
	Latency: 0, Cache Line Size: 64 bytes
	Interrupt: pin A routed to IRQ 30
	Region 0: Memory at f6adc000 (64-bit, non-prefetchable) [size=16K]
	Capabilities: <access denied>
	Kernel driver in use: HDA Intel
	Kernel modules: snd-hda-intel

00:1c.0 PCI bridge [0604]: Intel Corporation 82801I (ICH9 Family) PCI Express Port 1 [8086:2940] (rev 03) (prog-if 00 [Normal decode])
	Control: I/O+ Mem+ BusMaster+ SpecCycle- MemWINV- VGASnoop- ParErr- Stepping- SERR+ FastB2B- DisINTx+
	Status: Cap+ 66MHz- UDF- FastB2B- ParErr- DEVSEL=fast >TAbort- <TAbort- <MAbort- >SERR- <PERR- INTx-
	Latency: 0, Cache Line Size: 64 bytes
	Bus: primary=00, secondary=0b, subordinate=0b, sec-latency=0
	I/O behind bridge: 00002000-00002fff
	Memory behind bridge: c4000000-c41fffff
	Prefetchable memory behind bridge: 00000000c4200000-00000000c43fffff
	Secondary status: 66MHz- FastB2B- ParErr- DEVSEL=fast >TAbort- <TAbort- <MAbort+ <SERR- <PERR-
	BridgeCtl: Parity- SERR+ NoISA- VGA- MAbort- >Reset- FastB2B-
		PriDiscTmr- SecDiscTmr- DiscTmrStat- DiscTmrSERREn-
	Capabilities: <access denied>
	Kernel driver in use: pcieport
	Kernel modules: shpchp

00:1c.1 PCI bridge [0604]: Intel Corporation 82801I (ICH9 Family) PCI Express Port 2 [8086:2942] (rev 03) (prog-if 00 [Normal decode])
	Control: I/O+ Mem+ BusMaster+ SpecCycle- MemWINV- VGASnoop- ParErr- Stepping- SERR+ FastB2B- DisINTx+
	Status: Cap+ 66MHz- UDF- FastB2B- ParErr- DEVSEL=fast >TAbort- <TAbort- <MAbort- >SERR- <PERR- INTx-
	Latency: 0, Cache Line Size: 64 bytes
	Bus: primary=00, secondary=0c, subordinate=0c, sec-latency=0
	I/O behind bridge: 00003000-00003fff
	Memory behind bridge: f6900000-f69fffff
	Prefetchable memory behind bridge: 00000000c4400000-00000000c45fffff
	Secondary status: 66MHz- FastB2B- ParErr- DEVSEL=fast >TAbort- <TAbort- <MAbort+ <SERR- <PERR-
	BridgeCtl: Parity- SERR+ NoISA- VGA- MAbort- >Reset- FastB2B-
		PriDiscTmr- SecDiscTmr- DiscTmrStat- DiscTmrSERREn-
	Capabilities: <access denied>
	Kernel driver in use: pcieport
	Kernel modules: shpchp

00:1c.3 PCI bridge [0604]: Intel Corporation 82801I (ICH9 Family) PCI Express Port 4 [8086:2946] (rev 03) (prog-if 00 [Normal decode])
	Control: I/O+ Mem+ BusMaster+ SpecCycle- MemWINV- VGASnoop- ParErr- Stepping- SERR- FastB2B- DisINTx+
	Status: Cap+ 66MHz- UDF- FastB2B- ParErr- DEVSEL=fast >TAbort- <TAbort- <MAbort- >SERR- <PERR- INTx-
	Latency: 0, Cache Line Size: 64 bytes
	Bus: primary=00, secondary=0d, subordinate=0e, sec-latency=0
	I/O behind bridge: 0000d000-0000dfff
	Memory behind bridge: f6600000-f68fffff
	Prefetchable memory behind bridge: 00000000f0000000-00000000f01fffff
	Secondary status: 66MHz- FastB2B- ParErr- DEVSEL=fast >TAbort- <TAbort- <MAbort+ <SERR- <PERR-
	BridgeCtl: Parity- SERR+ NoISA- VGA- MAbort- >Reset- FastB2B-
		PriDiscTmr- SecDiscTmr- DiscTmrStat- DiscTmrSERREn-
	Capabilities: <access denied>
	Kernel driver in use: pcieport
	Kernel modules: shpchp

00:1d.0 USB Controller [0c03]: Intel Corporation 82801I (ICH9 Family) USB UHCI Controller #1 [8086:2934] (rev 03) (prog-if 00 [UHCI])
	Subsystem: Dell Device [1028:0252]
	Control: I/O+ Mem- BusMaster+ SpecCycle- MemWINV- VGASnoop- ParErr- Stepping- SERR- FastB2B- DisINTx-
	Status: Cap+ 66MHz- UDF- FastB2B+ ParErr- DEVSEL=medium >TAbort- <TAbort- <MAbort- >SERR- <PERR- INTx-
	Latency: 0
	Interrupt: pin A routed to IRQ 20
	Region 4: I/O ports at 6f00 [size=32]
	Capabilities: <access denied>
	Kernel driver in use: uhci_hcd
	Kernel modules: uhci-hcd

00:1d.1 USB Controller [0c03]: Intel Corporation 82801I (ICH9 Family) USB UHCI Controller #2 [8086:2935] (rev 03) (prog-if 00 [UHCI])
	Subsystem: Dell Device [1028:0252]
	Control: I/O+ Mem- BusMaster+ SpecCycle- MemWINV- VGASnoop- ParErr- Stepping- SERR- FastB2B- DisINTx-
	Status: Cap+ 66MHz- UDF- FastB2B+ ParErr- DEVSEL=medium >TAbort- <TAbort- <MAbort- >SERR- <PERR- INTx-
	Latency: 0
	Interrupt: pin B routed to IRQ 21
	Region 4: I/O ports at 6f20 [size=32]
	Capabilities: <access denied>
	Kernel driver in use: uhci_hcd
	Kernel modules: uhci-hcd

00:1d.2 USB Controller [0c03]: Intel Corporation 82801I (ICH9 Family) USB UHCI Controller #3 [8086:2936] (rev 03) (prog-if 00 [UHCI])
	Subsystem: Dell Device [1028:0252]
	Control: I/O+ Mem- BusMaster+ SpecCycle- MemWINV- VGASnoop- ParErr- Stepping- SERR- FastB2B- DisINTx-
	Status: Cap+ 66MHz- UDF- FastB2B+ ParErr- DEVSEL=medium >TAbort- <TAbort- <MAbort- >SERR- <PERR- INTx-
	Latency: 0
	Interrupt: pin C routed to IRQ 22
	Region 4: I/O ports at 6f40 [size=32]
	Capabilities: <access denied>
	Kernel driver in use: uhci_hcd
	Kernel modules: uhci-hcd

00:1d.7 USB Controller [0c03]: Intel Corporation 82801I (ICH9 Family) USB2 EHCI Controller #1 [8086:293a] (rev 03) (prog-if 20 [EHCI])
	Subsystem: Dell Device [1028:0252]
	Control: I/O- Mem+ BusMaster+ SpecCycle- MemWINV- VGASnoop- ParErr- Stepping- SERR+ FastB2B- DisINTx-
	Status: Cap+ 66MHz- UDF- FastB2B+ ParErr- DEVSEL=medium >TAbort- <TAbort- <MAbort- >SERR- <PERR- INTx-
	Latency: 0
	Interrupt: pin A routed to IRQ 20
	Region 0: Memory at fed1c000 (32-bit, non-prefetchable) [size=1K]
	Capabilities: <access denied>
	Kernel driver in use: ehci_hcd
	Kernel modules: ehci-hcd

00:1e.0 PCI bridge [0604]: Intel Corporation 82801 Mobile PCI Bridge [8086:2448] (rev 93) (prog-if 01 [Subtractive decode])
	Control: I/O+ Mem+ BusMaster+ SpecCycle- MemWINV- VGASnoop- ParErr- Stepping- SERR+ FastB2B- DisINTx-
	Status: Cap+ 66MHz- UDF- FastB2B- ParErr- DEVSEL=fast >TAbort- <TAbort- <MAbort- >SERR- <PERR- INTx-
	Latency: 0
	Bus: primary=00, secondary=02, subordinate=06, sec-latency=32
	I/O behind bridge: 00004000-00004fff
	Memory behind bridge: f6500000-f65fffff
	Prefetchable memory behind bridge: 00000000c0000000-00000000c3ffffff
	Secondary status: 66MHz- FastB2B+ ParErr- DEVSEL=medium >TAbort- <TAbort- <MAbort+ <SERR- <PERR-
	BridgeCtl: Parity- SERR+ NoISA- VGA- MAbort- >Reset- FastB2B-
		PriDiscTmr- SecDiscTmr- DiscTmrStat- DiscTmrSERREn-
	Capabilities: <access denied>

00:1f.0 ISA bridge [0601]: Intel Corporation ICH9M-E LPC Interface Controller [8086:2917] (rev 03)
	Subsystem: Dell Device [1028:0252]
	Control: I/O+ Mem+ BusMaster+ SpecCycle- MemWINV- VGASnoop- ParErr- Stepping- SERR+ FastB2B- DisINTx-
	Status: Cap+ 66MHz- UDF- FastB2B- ParErr- DEVSEL=medium >TAbort- <TAbort- <MAbort- >SERR- <PERR- INTx-
	Latency: 0
	Capabilities: <access denied>
	Kernel modules: iTCO_wdt

00:1f.2 RAID bus controller [0104]: Intel Corporation Mobile 82801 SATA RAID Controller [8086:282a] (rev 03)
	Subsystem: Dell Device [1028:0252]
	Control: I/O+ Mem+ BusMaster+ SpecCycle- MemWINV- VGASnoop- ParErr- Stepping- SERR- FastB2B- DisINTx+
	Status: Cap+ 66MHz+ UDF- FastB2B+ ParErr- DEVSEL=medium >TAbort- <TAbort- <MAbort- >SERR- <PERR- INTx-
	Latency: 0
	Interrupt: pin D routed to IRQ 27
	Region 0: I/O ports at 6e70 [size=8]
	Region 1: I/O ports at 6e78 [size=4]
	Region 2: I/O ports at 6e80 [size=8]
	Region 3: I/O ports at 6e88 [size=4]
	Region 4: I/O ports at 6ea0 [size=32]
	Region 5: Memory at fed1c800 (32-bit, non-prefetchable) [size=2K]
	Capabilities: <access denied>
	Kernel driver in use: ahci
	Kernel modules: ahci

00:1f.3 SMBus [0c05]: Intel Corporation 82801I (ICH9 Family) SMBus Controller [8086:2930] (rev 03)
	Subsystem: Dell Device [1028:0252]
	Control: I/O+ Mem+ BusMaster- SpecCycle- MemWINV- VGASnoop- ParErr- Stepping- SERR+ FastB2B- DisINTx-
	Status: Cap- 66MHz- UDF- FastB2B+ ParErr- DEVSEL=medium >TAbort- <TAbort- <MAbort- >SERR- <PERR- INTx-
	Interrupt: pin B routed to IRQ 19
	Region 0: Memory at f6adaf00 (64-bit, non-prefetchable) [size=256]
	Region 4: I/O ports at 1100 [size=32]
	Kernel driver in use: i801_smbus
	Kernel modules: i2c-i801

02:01.0 CardBus bridge [0607]: Texas Instruments PCIxx12 Cardbus Controller [104c:8039]
	Control: I/O+ Mem+ BusMaster+ SpecCycle- MemWINV- VGASnoop- ParErr- Stepping- SERR- FastB2B- DisINTx-
	Status: Cap+ 66MHz- UDF- FastB2B- ParErr- DEVSEL=medium >TAbort- <TAbort- <MAbort- >SERR- <PERR- INTx-
	Latency: 168, Cache Line Size: 64 bytes
	Interrupt: pin A routed to IRQ 18
	Region 0: Memory at f6500000 (32-bit, non-prefetchable) [size=4K]
	Bus: primary=02, secondary=03, subordinate=06, sec-latency=176
	Memory window 0: c0000000-c3fff000 (prefetchable)
	Memory window 1: c8000000-cbfff000
	I/O window 0: 00004000-000040ff
	I/O window 1: 00004400-000044ff
	BridgeCtl: Parity- SERR- ISA- VGA- MAbort- >Reset+ 16bInt+ PostWrite+
	<access denied to the rest>
	Kernel driver in use: yenta_cardbus
	Kernel modules: yenta_socket

02:01.1 FireWire (IEEE 1394) [0c00]: Texas Instruments PCIxx12 OHCI Compliant IEEE 1394 Host Controller [104c:803a] (prog-if 10 [OHCI])
	Subsystem: Dell Device [1028:0252]
	Control: I/O- Mem+ BusMaster+ SpecCycle- MemWINV+ VGASnoop- ParErr- Stepping- SERR+ FastB2B- DisINTx-
	Status: Cap+ 66MHz- UDF- FastB2B- ParErr- DEVSEL=medium >TAbort- <TAbort- <MAbort- >SERR- <PERR- INTx-
	Latency: 64 (500ns min, 1000ns max), Cache Line Size: 64 bytes
	Interrupt: pin B routed to IRQ 19
	Region 0: Memory at f65fb800 (32-bit, non-prefetchable) [size=2K]
	Region 1: Memory at f65fc000 (32-bit, non-prefetchable) [size=16K]
	Capabilities: <access denied>
	Kernel driver in use: ohci1394
	Kernel modules: ohci1394

02:01.3 SD Host controller [0805]: Texas Instruments PCIxx12 SDA Standard Compliant SD Host Controller [104c:803c] (prog-if 01)
	Subsystem: Dell Device [1028:0252]
	Control: I/O- Mem+ BusMaster+ SpecCycle- MemWINV- VGASnoop- ParErr- Stepping- SERR+ FastB2B- DisINTx-
	Status: Cap+ 66MHz- UDF- FastB2B- ParErr- DEVSEL=medium >TAbort- <TAbort- <MAbort- >SERR- <PERR- INTx-
	Latency: 64 (1750ns min, 1000ns max), Cache Line Size: 64 bytes
	Interrupt: pin A routed to IRQ 18
	Region 0: Memory at f65fb700 (32-bit, non-prefetchable) [size=256]
	Capabilities: <access denied>
	Kernel driver in use: sdhci-pci
	Kernel modules: sdhci-pci

0c:00.0 Network controller [0280]: Intel Corporation Wireless WiFi Link 5100 [8086:4232]
	Subsystem: Intel Corporation Wireless WiFi Link 5100 [8086:1321]
	Control: I/O- Mem+ BusMaster+ SpecCycle- MemWINV- VGASnoop- ParErr- Stepping- SERR+ FastB2B- DisINTx+
	Status: Cap+ 66MHz- UDF- FastB2B- ParErr- DEVSEL=fast >TAbort- <TAbort- <MAbort- >SERR- <PERR- INTx-
	Latency: 0, Cache Line Size: 64 bytes
	Interrupt: pin A routed to IRQ 31
	Region 0: Memory at f69fe000 (64-bit, non-prefetchable) [size=8K]
	Capabilities: <access denied>
	Kernel driver in use: iwlagn
	Kernel modules: iwlagn

